{
  "schema_version": 1,
  "workspace_id": "07892e5f-ce47-494c-9e28-b862fecf1674",
  "revision": 1,
  "active_window_id": "7a78b4d0-a0a8-4d4f-a4df-03062b9e0b06",
  "windows": [
    {
      "id": "7a78b4d0-a0a8-4d4f-a4df-03062b9e0b06",
      "order": 0,
      "active_worklane_id": "51409604-66ce-4da0-86df-7e9389d80b16",
      "worklanes": [
        {
          "id": "51409604-66ce-4da0-86df-7e9389d80b16",
          "order": 0,
          "title": "Safe fixture",
          "layout": {
            "columns": [
              {
                "index": 0,
                "weight": 1.0
              }
            ]
          },
          "active_pane_id": "5ef3374d-610e-4d97-b1bd-a5fba93a6f28",
          "panes": [
            {
              "id": "5ef3374d-610e-4d97-b1bd-a5fba93a6f28",
              "order": 0,
              "title": null,
              "layout": {
                "column": 0,
                "row": 0,
                "row_weight": 1.0
              },
              "cwd": "/home/user/project",
              "command": {
                "launch_profile_id": "default-shell"
              },
              "agent": null
            }
          ]
        }
      ]
    }
  ]
}
